{
  "id": "char_001",
  "name": "인물 이름",
  "aliases": [],
  "role": "supporting",
  "basic": {
    "age": 0,
    "gender": "",
    "birthday": "",
    "appearance": {
      "height": "",
      "build": "",
      "features": []
    },
    "voice": {
      "tone": "",
      "speech_pattern": "",
      "vocabulary": "선호 어휘: ; 금지 어휘: ",
      "signature_phrases": ["그러니까", "확실히 하자"],
      "speech_examples": [
        {
          "situation": "평상시",
          "dialogue": "지금은 확인부터 하자."
        },
        {
          "situation": "화났을 때",
          "dialogue": "그 말, 그냥 넘길 수 없어."
        },
        {
          "situation": "좋아하는 사람 앞에서",
          "dialogue": "괜찮아. 내가 먼저 볼게."
        }
      ],
      "dialect": "표준어",
      "formality_level": "neutral"
    }
  },
  "background": {
    "origin": "",
    "family": "",
    "education": "",
    "occupation": "",
    "economic_status": "",
    "trauma": "",
    "secret": {
      "content": "",
      "reveal_chapter": 3
    }
  },
  "inner": {
    "want": "",
    "need": "",
    "fatal_flaw": "",
    "values": [],
    "fears": []
  },
  "personality": {
    "mbti": "ISTJ",
    "temperament": "mixed",
    "traits": ["신중함", "집요함", "책임감"],
    "introvert_extrovert": 5,
    "emotional_stability": 5,
    "openness": 5
  },
  "intelligence": {
    "iq_level": "average",
    "emotional_iq": "average",
    "street_smart": "average",
    "learning_style": "visual",
    "strengths": [],
    "weaknesses": []
  },
  "behavior": {
    "habits": [],
    "hobbies": [],
    "likes": [],
    "dislikes": [],
    "stress_response": "",
    "lying_tell": ""
  },
  "relationships": [],
  "arc": {
    "start_state": "",
    "catalyst": "",
    "midpoint": "",
    "dark_night": "",
    "transformation": "",
    "end_state": ""
  },
  "notes": ""
}
